{
  "version": 3,
  "generated_at": "2026-06-26T00:00:00+00:00",
  "snapshot_at": "2026-06-26T00:00:00+00:00",
  "counts": { "total": 1 },
  "projects": [
    {
      "full_name": "evil/<img src=x onerror=alert(1)>",
      "html_url": "javascript:alert(1)",
      "description": "<script>alert(1)</script>",
      "language": "\" onmouseover=\"alert(1)",
      "topics": ["bci", "<svg/onload=alert(1)>"],
      "category": "Signal Processing",
      "evidence_tier": "L3_EXPLICIT_BCI",
      "inclusion_reason": "Crafted hostile payload for injection regression tests."
    }
  ]
}
